id;siteId;assessmentCriteriaId;logDate;oldScore;newScore;oldRecommendationDescription;newRecommendationDescription;oldRecommendationStatusId;newRecommendationStatusId;oldNotes;newNotes;createDate;createdBy;updateDate;updatedBy
909;36;49;36:42.2;3;2;;Wireless assessment or LC;6;2; ;Some WAPs approaching EOL;;;;
910;36;50;37:17.3;3;2;;Add redundancy to some critical L2 switches;6;2; ;Many WAPs connected to single L2 switches;;;;
911;62;47;41:44.7;1;1;LAN and Cable Assessment is highly recommended.;LAN and Cable Assessment is highly recommended.;2;2;Single points of failure found in Admin LAN, and also plant LAN;Single points of failure found in Admin LAN, single switches hosting multiple servers and WAPs;25:31.2;;28:17.9;CHRIS SOUTHERN
912;120;43;11:24.3;2;3;WAN devices will be replaced during SDWAN migration;;3;6;Legacy Cisco routers are deployed;SD WAN has been deployed;07:47.9;;07:47.9;CHRIS SOUTHERN
913;120;45;11:51.5;2;3;WAN infra will be replaced by SDWAN migration;;3;6;;SD WAN has been deployed;08:29.2;;08:29.2;CHRIS SOUTHERN
914;62;47;42:32.2;1;1;LAN and Cable Assessment is highly recommended.;LAN and Cable Assessment is highly recommended.;2;2;Single points of failure found in Admin LAN, single switches hosting multiple servers and WAPs;Single points of failure found in Admin LAN, single switches hosting multiple servers and WAPs.  single points of failure and daisy chain in plant LAN;25:31.2;;41:44.7;CHRIS_SOUTHERN@CRGL-THIRDPARTY.COM
915;62;43;43:40.3;2;3;SDWAN Program will replace the routers, no actions required;;2;6;Routers approaching EOL;Standard SDWAN devices are deployed;22:07.1;;22:07.1;CHRIS SOUTHERN
916;62;45;43:53.5;3;3;;;2;6;WAN infra has appropriate redundancy;Standard SDWAN infra has appropriate redundancy;22:24.5;;22:24.5;CHRIS SOUTHERN
917;4;6;33:16.0;1;1;2 standalone ESX hosts - (vhdekref001/vhdekref002) Decommission standalone ESX hosts after migrating or moving virtual machines to other hardware;2 standalone ESX hosts - (vhdekref001/vhdekref002) Decommission standalone ESX hosts after migrating or moving virtual machines to other hardware;2;5;;1-	vhdekref001 and vhdekref002 are decommissioned. Decommissioned CR# CRQ000000432882 and CRQ000000583861.;;;;
918;4;4;34:04.0;1;1;2 standalone ESX hosts - (vhdekref001/vhdekref002) Decommission standalone ESX hosts after migrating or moving virtual machines to other hardware;2 standalone ESX hosts - (vhdekref001/vhdekref002) Decommission standalone ESX hosts after migrating or moving virtual machines to other hardware;2;5;;1-	vhdekref001 and vhdekref002 are decommissioned. Decommissioned CR# CRQ000000432882 and CRQ000000583861.;;;;
919;4;1;35:15.9;1;1;There are 6 server still running on windows 2008 (msdekref010/011, msdekrep001, msdekrpl003/004/009). Upgrade windows 2008 servers with windows 2016 or migrate to new hardware on PCG domain or decommission where possible;There are 6 server still running on windows 2008 (msdekref010/011, msdekrep001, msdekrpl003/004/009). Upgrade windows 2008 servers with windows 2016 or migrate to new hardware on PCG domain or decommission where possible;2;3;;msdekref010 -   Already replaced with msdekreo011, 010 will be decommission in May’22.msdekrep001 – it seems this server is decommissioned but still showing “deployed” in CMDBmsdekrpl003 – decommissioned - CRQ000000416536msdekrpl004 – decommissioned- CRQ000000508508msdekrpl009 -  Under Migration, this server will be moved to PCG domain, no replacement ETA for decommission May’22.;;;;
920;118;21;25:54.0;1;1;assessment required to check current situation;clean up the room (still not performed;2;2;during implementation of P-16523 spare parts and a lot of dust was present. action back then was to remove spare parts and regularly clean the room. not known whether this is performed;during implementation of P-16523 spare parts and a lot of dust was present. action back then was to remove spare parts and regularly clean the room. not known whether this is performed.new info as part of  P-474706 shows, this is still the case;08:06.9;;08:06.9;FABIO FERKET
921;65;4;17:19.9;3;2;;Network cables for server NLDEVE002M are all going to same switch;2;2;One standalone File and print server .;One standalone File and print server .;52:03.8;;54:23.3;DEVAPRABHUPENNIEL CHELLAPPA
922;65;4;19:42.6;2;2;Network cables for server NLDEVE002M are all going to same switch;Network cables for file server NLDEVE002M are all going to same switch;2;2;One standalone File and print server .;One standalone File and print server .;52:03.8;;17:19.9;SERGE_DE_SCHEPPER@CRGL-THIRDPARTY.COM
923;26;4;21:44.6;3;2;;All network cables for file server MSBEMOUS005 are going to the same switch. Better to spread across multiple switches.;2;2;NA - No Critical servers at this site.;NA - No Critical servers at this site.;36:07.6;;57:39.8;DEVAPRABHUPENNIEL_CHELLAPPA@CRGL-THIRDPARTY.COM
924;93;46;21:34.3;2;3;Lifecycle;;3;6;Most of the LAN devices are fully compliant and supported.  Others that are not are in the lifecycle process.;Life cycle has taken place;57:31.2;;57:31.2;CHRIS SOUTHERN
925;65;4;22:15.2;2;2;Network cables for file server NLDEVE002M are all going to same switch;Network cables for file server NLDEVE002M are all going to same switch. Better to spread across multiple switches.;2;2;One standalone File and print server .;One standalone File and print server .;52:03.8;;19:42.6;SERGE_DE_SCHEPPER@CRGL-THIRDPARTY.COM
926;61;4;24:50.0;3;2;;Network cables for VRTX are all going to one switch, better to spread connection across multiple switches.;2;2;;;46:23.9;;46:23.9;DEVAPRABHUPENNIEL CHELLAPPA
927;100;45;03:14.0;3;2;;Order and install additional internet circuit;6;2;SDWAN redundant solution has been deployed;Tier 1 sites required dual internet circuits;25:53.7;;29:49.8;CHRIS SOUTHERN
928;49;47;11:41.4;2;1;;Admin L2 has many hardware single point of failures;2;2;LC has been done but LAN design is old;;46:40.4;;46:40.4;CHRIS SOUTHERN
929;61;4;32:10.0;2;2;Network cables for VRTX are all going to one switch, better to spread connection across multiple switches.;Network cables for VRTX are all going to one switch, better to spread connection across multiple switches. Production is all in one computer room but side has 2 rooms. In case of outage for the computer room production is down.;2;2;;;46:23.9;;24:50.0;SERGE_DE_SCHEPPER@CRGL-THIRDPARTY.COM
930;3;4;27:51.3;1;1;VHDEBARB001 is a standalone ESX host, no cluster availability;VHDEBARB001 is a standalone ESX host, no cluster availability;2;5;;Decommissioned as per CRQ000000508836;;;;
931;3;4;28:16.6;1;1;VHDEBARB001 is a standalone ESX host, no cluster availability;VHDEBARB001 is a standalone ESX host, no cluster availability;5;5;Decommissioned as per CRQ000000508836;Decommissioned as per CRQ000000508836;;;27:51.4;HUZAIFA_SUNASARA@CRGL-THIRDPARTY.COM
932;3;1;29:14.9;1;1;ESX host vhdebarb001 out of warranty, 3 Vms running with Windows 2008 MSDEBAPL002, MSDEBAPL027, & MSDEBAPL10;ESX host vhdebarb001 out of warranty, 3 Vms running with Windows 2008 MSDEBAPL002, MSDEBAPL027, & MSDEBAPL10;2;6;;vhdebarb001 is decommissioned as per CRQ000000508836;;;;
933;3;6;29:52.3;1;1;VHDEBARB001 is a standalone ESX host, no cluster availability;VHDEBARB001 is a standalone ESX host, no cluster availability;2;6;;VHDEBARB001 is decommissioned as per CRQ000000508836;;;;
934;3;3;38:03.0;1;1;3 VM running with Microsoft Windows 2008/ ;3 VM running with Microsoft Windows 2008/;2;6;;All 3 VMs are decommissionedMSDEBAPL002 - CRQ000000435796MSDEBAPL027 - CRQ000000457453MSDEBAPL10 - CRQ000000435796;;;;
935;3;4;40:41.2;1;1;VHDEBARB001 is a standalone ESX host, no cluster availability;VHDEBARB001 is a standalone ESX host, no cluster availability;5;6;Decommissioned as per CRQ000000508836;Decommissioned as per CRQ000000508836;;;28:16.6;HUZAIFA_SUNASARA@CRGL-THIRDPARTY.COM
936;29;39;03:17.6;2;2;;decision to be made regarding criticality of several CR's on site and look at possibilities to move CR's or expand as there is no free rack space present anymore to add equipment before removing equipment;2;2;not all racks could be exchanged by standard racks due to busines impact at that time;not all racks could be exchanged by standard racks due to busines impact at that timemost of the racks are full;;;;
937;88;42;25:10.8;1;3;replace lengthy cabling wit proper length cabling, remove unused cabling and prevent sharp bends in copper and fibre cabling;replace lengthy cabling wit proper length cabling, remove unused cabling and prevent sharp bends in copper and fibre cabling;2;5;;P-1057901 implemented cable cleanup;43:52.7;;02:03.5;FABIO FERKET
938;88;36;10:52.1;2;3;consider installing external by pass panel;consider installing external by pass panel;2;5;;bypass installed;58:35.3;;58:35.3;FABIO FERKET
939;123;43;59:55.0;3;3;;;2;6;Cisco Router are within support.;Standard SDWAN devices are deployed;56:54.4;;56:54.4;ALEX ABREU
940;123;45;00:30.9;2;3;P-474706 - Regional SD WAN program will change site to SD WAN.;;3;6;;Standard SDWAN solution is deployed;57:36.3;;57:36.3;ALEX ABREU
941;88;42;09:37.6;3;3;replace lengthy cabling wit proper length cabling, remove unused cabling and prevent sharp bends in copper and fibre cabling;replace lengthy cabling wit proper length cabling, remove unused cabling and prevent sharp bends in copper and fibre cabling;5;5;P-1057901 implemented cable cleanup;P-1057901 implemented cable cleanup;43:52.7;;25:10.8;FABIO_FERKET@CRGL-THIRDPARTY.COM
942;88;19;10:04.6;2;3;based on info cabling is entering rack under raised floor, hower pictures also show some cabling just laying on floor. this is a tripping hazard. use cable trays;based on info cabling is entering rack under raised floor, hower pictures also show some cabling just laying on floor. this is a tripping hazard. use cable trays;2;5;;done as part of P-1057901;53:23.3;;53:35.6;FABIO FERKET
943;88;21;10:33.4;1;3;room is in terrible shape, old chairs furniture etc stored in the CR, boxes, printiercartridges etc present. it is basically a room used to dump everything no one wants to have. remove all non active IT components and clean room. this is a huge risk (dust cardboard act as fire accelerator, and damages the equipment;room is in terrible shape, old chairs furniture etc stored in the CR, boxes, printiercartridges etc present. it is basically a room used to dump everything no one wants to have. remove all non active IT components and clean room. this is a huge risk (dust cardboard act as fire accelerator, and damages the equipment;2;5;;implemented as part of P-1057901;56:21.8;;56:21.8;FABIO FERKET
944;88;41;11:19.1;1;3;install shelves for devices. curently devices are bending due to weight of device (eg tape library) on top of it. this will cause damage;install shelves for devices. curently devices are bending due to weight of device (eg tape library) on top of it. this will cause damage;2;5;;done as part of P-1057901;03:02.6;;03:02.6;FABIO FERKET
945;88;33;12:11.3;1;1;domestic use powerstrips used, looking at pictures they might even be daisy chained. RPDU's (server graded) or not fixed in racks, correct this as well;domestic use powerstrips used, looking at pictures they might even be daisy chained. RPDU's (server graded) or not fixed in racks, correct this as well;2;5;;corrected as part of P-1057901;04:06.0;;04:06.0;FABIO FERKET
946;88;33;12:28.7;1;3;domestic use powerstrips used, looking at pictures they might even be daisy chained. RPDU's (server graded) or not fixed in racks, correct this as well;domestic use powerstrips used, looking at pictures they might even be daisy chained. RPDU's (server graded) or not fixed in racks, correct this as well;5;5;corrected as part of P-1057901;corrected as part of P-1057901;04:06.0;;12:11.3;FABIO_FERKET@CRGL-THIRDPARTY.COM
947;88;37;12:49.0;2;3;unclear what ages and health of UPS is. check batteries and age;unclear what ages and health of UPS is. check batteries and age;2;5;;new UPS installed as part of P-1057901;05:22.6;;05:22.6;FABIO FERKET
948;88;40;13:29.9;1;3;racks do not have rear doors. install rear doors. if not possible, replace racks;racks do not have rear doors. install rear doors. if not possible, replace racks;2;5;;rear doors installed as part of P-1057901;08:12.9;;08:12.9;FABIO FERKET
949;88;39;16:23.2;2;3;some of the racks are not wide or deep enough to do proper cable management or are not deep enough to house all equipment. replace racks with standard racks;some of the racks are not wide or deep enough to do proper cable management or are not deep enough to house all equipment. replace racks with standard racks;2;5;;re-organize racks took care of enough space;07:38.4;;07:38.4;FABIO FERKET
950;103;49;35:10.7;1;2;Wireless LAN Assessment;Review capacity at other parts of the facility;2;2;End of Life WAPs found in the inventory;Hardware has been life cycled;54:12.8;;54:12.8;CHRIS SOUTHERN
951;72;50;10:32.6;3;1;;Critical/tier 1 site should have local WLC;2;2;Standard flex connect wireless design is deployed;Standard flex connect wireless design is deployed;19:45.8;;19:45.8;CHRIS SOUTHERN
952;88;40;16:43.7;3;3;racks do not have rear doors. install rear doors. if not possible, replace racks;racks do not have rear doors. install rear doors. if not possible, replace racks;5;5;rear doors installed as part of P-1057901;rear doors installed as part of P-1057901;08:12.9;;13:29.9;FABIO_FERKET@CRGL-THIRDPARTY.COM
953;88;18;17:21.5;2;3;racks are difficult to reach from back. moving racks forward will provide better service at back of racks;racks are difficult to reach from back. moving racks forward will provide better service at back of racks;2;5;;cleaunp performed;54:16.0;;54:16.0;FABIO FERKET
954;88;20;17:53.4;2;3;CR is used to store spare laptops/desktops. remove spares from CR or add an lockable metal cabinet to store spare parts;CR is used to store spare laptops/desktops. remove spares from CR or add an lockable metal cabinet to store spare parts;2;2;;computer room cleanup performed;55:27.7;;55:27.7;FABIO FERKET
955;88;16;18:23.4;1;2;Carpet present in the CR. this is generating a lot of dust, but even worse it causes static electricity. Remove carpet. there is s raised floor underneath that can remain but might need to be repaired if carpet is eg fixed with glue.ceiling tiles missing or badly damaged due to leakage old air conditioning unit;Carpet present in the CR. this is generating a lot of dust, but even worse it causes static electricity. Remove carpet. there is s raised floor underneath that can remain but might need to be repaired if carpet is eg fixed with glue.ceiling tiles missing or badly damaged due to leakage old air conditioning unit;2;2;;;58:55.1;;21:22.2;FABIO FERKET
956;88;34;19:47.0;2;3;UPS present and as such concept is fine. UPS is standing on the floor. better option is to place UPS inside a rack as the position it is now placed, someone can fall over it and worse case disconnect the UPS;UPS present and as such concept is fine. UPS is standing on the floor. better option is to place UPS inside a rack as the position it is now placed, someone can fall over it and worse case disconnect the UPS;2;5;;New UPS installed and placed in dedicated rack as part ofP-1057901;56:52.6;;56:52.6;FABIO FERKET
957;88;46;35:44.1;2;2;;;2;2;Most LAN devices are standard fully supported models however, there are also some devices approaching end of support hardware status;P-1057901 added additional stack member to wolverhampton4-swt switch stack but this does not alter below comments.Most LAN devices are standard fully supported models however, there are also some devices approaching end of support hardware status;55:44.9;;55:44.9;CHRIS SOUTHERN
958;88;47;35:59.6;1;1;LAN Redesign;LAN Redesign;2;2;Multiple single points of failure and many daisy chained switch connections are found, this brings a major risk of service outages in some areas of the LAN;P-1057901 added additional stack member to wolverhampton4-swt switch stack but this does not alter below comments.Multiple single points of failure and many daisy chained switch connections are found, this brings a major risk of service outages in some areas of the LAN;57:00.0;;01:01.6;CHRIS_SOUTHERN@CRGL-THIRDPARTY.COM
959;117;49;38:23.5;2;3;Wireless access points are reaching end of life. These need to be replaced.;;2;2;Access points will be replaced by life cycle.;Project P-782212 took care of wireless.;39:33.6;;39:33.6;ALEX ABREU
960;57;51;37:08.8;3;3;;;2;2;Standard plant segmentation solution is deployed;Hardware used is standard;34:45.8;;34:45.8;CHRIS SOUTHERN
961;57;43;40:26.8;2;3;;;2;6;Routers approaching EOL;Standard SD WAN hardware used;20:36.2;;20:36.2;CHRIS SOUTHERN
962;57;45;40:55.3;3;3;;;2;6;WAN design has full redundancy;Standard SD WAN design in place for Tier 2 site;20:57.3;;20:57.3;CHRIS SOUTHERN
963;17;52;54:53.6;3;1;;Deploy plant L2 hardware redundancy;6;2;;;;;;
964;17;50;56:12.8;2;2;;Some WAPs are connected to single L2 switches. Critical site requires dual hardware;2;2;;;;;;
965;2;47;00:46.9;3;1;;Deploy hardware redundancy;6;2;daisy chains in the LAN were removed in Jan 2021 under P-208202.  LAN is fully compliant.;;;;16:57.2;CHRIS SOUTHERN
966;88;16;21:35.6;2;2;Carpet present in the CR. this is generating a lot of dust, but even worse it causes static electricity. Remove carpet. there is s raised floor underneath that can remain but might need to be repaired if carpet is eg fixed with glue.ceiling tiles missing or badly damaged due to leakage old air conditioning unit;Carpet present in the CR. this is generating a lot of dust, but even worse it causes static electricity. Remove carpet. there is s raised floor underneath that can remain but might need to be repaired if carpet is eg fixed with glue.ceiling tiles missing or badly damaged due to leakage old air conditioning unit;2;5;;ceiling tiles installed. the only thing that remains is the carpet floor. as CR is now clean and tidy, floor can be cleaned regular, when possbile as part of office refurbishment, replace carpet;58:55.1;;18:23.4;FABIO_FERKET@CRGL-THIRDPARTY.COM
967;117;50;38:38.3;2;3;Once life cycle replaces the end of life access points the new devices should connect to the new wireless LAN controller (FlexOS);;2;6;Life cycle should connect new access points to new wireless LAN controller.;Project P-782212 took care of wireless.;47:42.5;;47:42.5;ALEX ABREU
968;121;43;59:27.5;2;3;SDWAN program will replace legacy WAN hardware;;3;6;Legacy WAN hardware is deployed;SD WAN replaced existing hardware;55:36.3;;55:36.3;CHRIS SOUTHERN
969;121;45;00:12.7;3;3;SDWAN program will replace WAN solution;;2;6;Active Active fully redundant solution is deployed;SD WAN deployed with Active Active fully redundant solution;56:08.5;;56:08.5;CHRIS SOUTHERN
970;121;44;25:26.7;2;2;SDWAN program will replace WAN solution;Potential for MPLS soft upgrade;3;2;Occasional WAN capacity concerns could be causing performance issues for users;Occasional WAN capacity concerns could be causing performance issues for users in the event of internet circuit failure.;54:53.8;;54:58.9;CHRIS SOUTHERN
971;3;44;22:53.3;1;3;70% uttilised, Link upgrade advsied;;2;6;link has become fully utilized and cannot be upgraded;SD WAN completed with appropriately sized MPLS and Internet circuits.;;;52:50.5;CHRIS SOUTHERN
972;26;46;28:53.1;1;1;Legacy devices will be replaced by P-415705;Provide Tier 1 redundancy for hardware and fibre;3;3;Some LAN devices approaching EOL, core switches are now past official EOL date (31 Oct 2021).;L3 admin switch upgraded via P-415705 Komodo project but LAN still far from perfect so hence score has not improved.;16:35.3;;55:35.5;CHRIS_SOUTHERN@CRGL-THIRDPARTY.COM
973;26;47;32:20.1;2;2;Legacy design will be replaced by P-415705;Provide Tier 1 redundancy for hardware and fibre via P-1305105 - CCC - EMEA - Mouscron - Tier 1 Upgrade;3;3;Some concerns with core LAN design and local fibre exist, impacting redundancy for L2 network;P-415705 project replaced the admin core but L2 network still lacks hardware and fibre redundancy.;17:12.9;;29:07.2;CHRIS_SOUTHERN@CRGL-THIRDPARTY.COM
974;26;49;36:00.7;2;3;;;2;6;Seven WAPs found in the inventory, most of current models but some are in need of life cycle;All models have been updated as part of SAP P-782212 & Komodo projects P-415705;34:57.0;;09:11.5;CHRIS SOUTHERN
975;26;50;36:32.2;3;3;;;6;6;Seven WAPs found in the inventory, no wireless assessment was found.  Standard flex solution is deployed and fully supported.;All models have been updated as part of SAP P-782212 & Komodo projects P-415705;09:52.1;;09:52.1;CHRIS SOUTHERN
976;44;44;24:18.0;2;3;;;2;6;Network capacity is appropriate with occiasional high utilisation;Bandwidth capacity is good since move to SD WAN.;17:23.5;;47:22.2;Nadelin Georgiev
977;44;43;24:49.3;2;3;;;2;6;Standard solution is deployed, cisco routers approaching EOL;SD WAN hardware is standard and well within life cycle;12:31.8;;47:02.8;Nadelin Georgiev
978;44;45;25:12.0;3;3;;;2;6;WAPs compliant but will not support wifi6;Design fits with Tier 1 standards;16:07.2;;51:49.5;Nadelin Georgiev
979;44;49;26:46.6;2;3;wireless assessment;;2;6;Most WAPs approaching EOL;Hardware used are all within life cycle and has plenty of years left;13:30.5;;50:52.5;Nadelin Georgiev
980;65;46;57:58.5;2;3;;;5;6;New computer room was installed. LAN hardware was moved from old computer room to new. Deventer switch 14 replaced with Deventer switch 27 and media converter removed. Does not change LAN compliance as there are still devices approaching end of life.;All devices are within life cycle.;53:20.1;;02:34.4;ALEX ABREU
981;65;44;00:42.9;1;1;SDWAN project will replace WAN infra;Soft upgrade bandwidth on MPLS and install second internet circuit to abide by critical site tier 1 standards.;3;2;WAN has frequent high utilisation there is a risk of performance issues if one of the two WAN links were to fail;SD WAN has been deployed but MPLS still sees some high utilisation and Tier 1 standard required x2 ISP circuits.;53:30.8;;11:47.4;CHRIS SOUTHERN
982;65;45;02:09.1;2;2;SDWAN project will replace WAN infra;Procure and install second internet circuit;3;2;WAN has appropriate redundancy, but there is a high risk of performance issues in the event of one circuit failure.;SD WAN deployed what was known at the time i.e. that this site was a Tier 2 but this has changed mid project.;56:02.7;;13:03.4;CHRIS SOUTHERN
983;61;46;10:00.1;1;1;LAN Assessment;Deploy L2 admin and plant hardware and fibre redundancy;3;2;EOL Hardware in the LAN, this EOL hardware remains high risk, lifecycle team are unable to get approval for replacement activities.;Reinickendorf has been identified as critical site so should have hardware and fibre redundancy on both admin and plant networks.;55:40.4;;31:08.1;CHRIS_SOUTHERN@CRGL-THIRDPARTY.COM
984;61;46;11:36.8;1;2;Deploy L2 admin and plant hardware and fibre redundancy;Deploy L2 admin and plant hardware and fibre redundancy;2;2;Reinickendorf has been identified as critical site so should have hardware and fibre redundancy on both admin and plant networks.;Life cycle has replaced many EOL devices but critical site require hardware redundancy.;55:40.4;;10:00.1;ALEX_ABREU@CRGL-THIRDPARTY.COM
985;61;47;12:16.8;2;1;;Deploy L2 admin and plant hardware and fibre redundancy.;2;2;LAN design is standard, but some switches are not redundant across the core switches.  some LAN hardware is EOL;Reinickendorf has been identified as critical site so should have hardware and fibre redundancy on both admin and plant networks.;56:03.3;;31:47.1;CHRIS_SOUTHERN@CRGL-THIRDPARTY.COM
986;61;44;13:25.8;2;2;;Critical site should have dual internet circuits.;2;2;WAN capacity is sufficient but in the event of one link failure there may be over usage.;WAN capacity is sufficient but in the event of one link failure there may be over usage.;54:55.5;;33:42.3;CHRIS_SOUTHERN@CRGL-THIRDPARTY.COM
987;61;43;15:04.4;2;2;None, SDWAN project will replace the existing routers;Replace SD WAN routers with appropriate models for critical tier 1 site.;2;2;Routers approaching EOL hardware support status;Previous design was done when site was judged to be tier 2. TCS did recommend for bigger chassis to be bought but that did not happen.;53:53.3;;53:53.3;CHRIS SOUTHERN
988;61;45;16:00.8;3;2;;Critical, tier 1 sites require dual internet circuits.;2;2;WAN infra is redundant, though routers approaching EOL hardware support status;SD WAN deployed tier 2 standard which at the time was correct.;54:17.9;;54:17.9;CHRIS SOUTHERN
989;61;49;25:58.1;1;2;WIFI Assessment project;Review if admin network needs wifi assessment and life cycle end of life WAP (reinickendorf40-wap);2;2;Two new WAPs, two old WAPs that are EOL hardware support status;SAP project P-782212 installed new WAPs and replaced others.;59:34.5;;59:34.5;CHRIS SOUTHERN
990;121;52;08:38.8;3;2;;Current firewall is single point of failure.;6;6;;Consider replacing with HA specially as LC is approaching.;21:08.1;;21:08.1;ALEX ABREU
991;44;46;19:21.8;1;2;Replace EOL switches;Some switches nearing end of life;2;2;There are EOL switches in the LAN;Consider budgeting for end of life switches.;12:59.1;;47:59.6;Nadelin Georgiev
992;44;51;22:40.2;3;3;;;2;2;Standard plant segmentation solution;Some plant LAN hardware are approaching end of life for a Tier 1 site.;14:47.2;;52:39.4;Nadelin Georgiev
993;61;50;29:10.3;1;1;;Admin network wireless assessment and deploy local controller solution;2;2;LAN design has not been done;Admin wireless assessment was not done as not in scope of SAP project P-782212. Existing topology is centralised and advised to have local controllers for critical, tier 1 sites.;00:29.3;;00:29.3;CHRIS SOUTHERN
