id;siteId;assessmentCriteriaId;logDate;oldScore;newScore;oldRecommendationDescription;newRecommendationDescription;oldRecommendationStatusId;newRecommendationStatusId;oldNotes;newNotes;createDate;createdBy;updateDate;updatedBy
542;60;43;55:10.0;2;3;none, SDWAN project will replace the WAN Hardware;;2;6;Routers are approaching EOL status;Standard SDWAN devices are deployed;02:48.3;;02:48.3;CHRIS SOUTHERN
543;118;20;16:40.5;2;2;check presence of spare parts;check presence of spare parts, and remove if present;2;2;;;16:19.0;;16:19.0;FABIO FERKET
544;65;41;31:45.1;2;3;;;5;5;New CR being installed P-797728;New CR being installed P-797728;53:09.2;;17:44.8;FABIO FERKET
545;65;18;32:32.3;1;3;New CR being installed P-797728;New CR being installed P-797728;3;5;;;54:34.6;;54:34.6;FABIO FERKET
546;70;45;39:24.7;3;2;;;6;2;Standard SD WAN solution is deployed;Standard SD WAN solution is deployed, however, the MPLS circuit is only 4mb therefore in the event of a failure on the internet circuit the site could suffer performance degradation.;54:25.3;;04:21.7;CHRIS SOUTHERN
547;60;45;55:36.3;1;3;Upgrade cabling infra to enable WAN redundancy;;2;6;The WAN infra is not fully redundant because the routers are only connected to one of the core switches due to cabling limitations;Standard SDWAN load sharing solution is deployed;04:03.2;;04:03.2;CHRIS SOUTHERN
548;118;18;15:53.6;2;2;;;2;6;room is small, limited space to work in rack. currently point of attention in case growth is expected;room is small, limited space to work in rack. currently point of attention in case growth is expected;15:39.8;;15:39.8;FABIO FERKET
549;113;31;17:08.1;3;2;;;6;6;;note that this is applicable for new server room. old server room does not have cooling installed. old room (under stairway, might need dedicated cooling in case equipment is added;00:33.2;;00:33.2;FABIO FERKET
550;113;32;18:50.6;3;3;;;6;6;;note that this is applicable for new server room. old server room does not have dedicated distribution panel;00:44.0;;00:44.0;FABIO FERKET
551;113;28;20:27.9;3;3;;;6;6;;note that this is applicable for new server room. old server room does not have cooling installed. old room (under stairway, might need dedicated cooling in case equipment is added;31:29.9;;31:40.4;FABIO FERKET
552;113;29;20:37.4;3;3;;;6;6;;note that this is applicable for new server room. old server room does not have cooling installed. old room (under stairway, might need dedicated cooling in case equipment is added;31:46.8;;31:46.8;FABIO FERKET
553;113;36;23:03.4;2;2;advise to add an external bypass as UPS system in rooms do not have an automatic bypass;advise to add an external bypass as UPS system in rooms do not have an automatic bypass;2;2;;this is not mandatory;22:48.5;;22:48.5;FABIO FERKET
554;113;23;23:19.7;3;3;;;6;6;;note that this is applicable for new server room. old server room does not have fire detection;55:01.0;;55:01.0;FABIO FERKET
555;113;30;32:24.3;3;3;;;6;6;;no cooling present in old CR;08:15.7;;08:15.7;FABIO FERKET
556;65;21;32:52.0;1;3;New CR being installed P-797728;;3;5;;;51:38.2;;51:38.2;FABIO FERKET
557;65;25;33:12.8;1;2;New CR being installed P-797728;implement access control;3;2;;;51:44.4;;51:44.4;FABIO FERKET
558;65;26;33:31.3;2;2;consider camera surveillance to protect property;consider camera surveillance to protect property;6;2;;;51:16.5;;45:45.3;FABIO FERKET
559;65;27;33:55.3;1;2;New CR being installed P-797728;implement visitor log;3;2;;;53:36.4;;53:36.4;FABIO FERKET
560;65;37;34:13.0;1;3;New CR being installed P-797728;New CR being installed P-797728;3;5;;;53:49.0;;53:49.0;FABIO FERKET
561;65;40;35:02.5;1;2;New CR being installed P-797728;;3;5;;most of the racks are now according to standard, few racks outside CR not. no immediate action required;54:29.2;;54:29.2;FABIO FERKET
562;65;20;35:48.7;1;3;New CR being installed P-797728;;3;5;;;54:52.3;;54:52.3;FABIO FERKET
563;41;44;26:08.2;2;3;consider WAN upgrade;;2;6;Occasional periods of high utilisation;SDWAN has been deployed;;;;
564;41;43;26:28.4;3;3;;;6;6;2 x MPLS standard design;Standard SDWAN devices have been deployed;;;;
565;41;45;26:45.7;3;3;;;6;6;;Standard SDWAN solution has been deployed at this site;;;;
566;100;43;29:24.8;2;3;SDWAN program will replace existing Cisco routers in 2021;;3;6;WAN devices are approaching end of support cycle;Standard SDWAN devices are deployed;25:09.0;;25:09.0;CHRIS SOUTHERN
567;100;45;29:49.8;3;3;;;2;6;WAN solution is active / standby with MPLS / VPN.  this is an acceptable standard solution.;SDWAN redundant solution has been deployed;25:53.7;;25:53.7;CHRIS SOUTHERN
568;48;44;42:44.3;3;3;;;2;6;;No WAN capacity concerns at this time;33:42.5;;33:42.5;Jim McColl
569;48;43;43:01.5;2;3;;;2;6;Routers approaching EOL;Standard SDWAN devices are deployed;33:20.8;;38:22.8;Jim McColl
570;48;45;43:18.8;3;3;;;5;6;;SDWAN solution has been deployed;34:00.0;;34:00.0;Jim McColl
571;111;51;30:48.8;3;3;;;6;6;plant firewall is compliant;plant segmentation firewall is compliant;29:50.3;;29:50.3;CHRIS SOUTHERN
572;111;16;22:12.5;3;2;;;6;6;;there is not enough information available whether there is enough space to add equipment. in current setup there seems to be no space to extend. point of attention for now;38:17.8;;38:17.8;FABIO FERKET
573;82;45;27:21.2;2;2;;;2;2;active - standby WAN design, with single connections to a single core switch.  WAN SPOF risk if the core switch fails.;SDWAN solution is deployed but there are still single connections to a single core switch.  WAN SPOF risk remains in the event of a core switch failure.;12:11.3;;12:11.3;CHRIS SOUTHERN
574;117;17;43:39.2;3;3;;;2;6;;;43:33.8;;43:33.8;FABIO FERKET
575;118;30;07:18.2;3;3;;;2;6;installed as part of provimi project 3 years ago;installed as part of provimi project 3 years ago;07:10.6;;07:10.6;FABIO FERKET
576;118;34;09:04.3;3;3;;;2;6;installed as part of provimi project 3 years ago;installed as part of provimi project 3 years ago;08:47.2;;08:47.2;FABIO FERKET
577;118;35;09:10.2;1;3;;;6;6;;;08:58.7;;08:58.7;FABIO FERKET
578;65;46;01:57.7;2;2;New CR being installed P-797728;;3;3;LAN has redundancy but has some devices approaching EOL;New computer room was installed. LAN hardware was moved from old computer room to new. Deventer switch 14 replaced with Deventer switch 27 and media converter removed. Does not change LAN compliance as there are still devices approaching end of life.;53:20.1;;09:28.1;CHRIS SOUTHERN
579;65;46;02:34.4;2;2;;;3;5;New computer room was installed. LAN hardware was moved from old computer room to new. Deventer switch 14 replaced with Deventer switch 27 and media converter removed. Does not change LAN compliance as there are still devices approaching end of life.;New computer room was installed. LAN hardware was moved from old computer room to new. Deventer switch 14 replaced with Deventer switch 27 and media converter removed. Does not change LAN compliance as there are still devices approaching end of life.;53:20.1;;01:57.7;ALEX ABREU
580;112;42;20:20.7;2;1;improve cable management by replacing lengthy cabling by proper length cabling;improve cable management by replacing lengthy cabling by proper length cabling, cabling hanging in the air and tied to curtains. properly route cabling via cable trays;2;2;information is more than three years old and is possibly outdated;information is more than three years old and is possibly outdated;13:56.1;;13:56.1;FABIO FERKET
581;13;52;13:42.4;3;1;;Plant L2 requires hardware redundancy;6;2;;;;;;
582;13;51;17:56.1;3;1;;Plant L3 core is end of life. Life cycle to replace;6;3;;Life cycle plans are showing for replacement;;;;
583;113;28;31:40.4;1;3;;;6;6;;;31:29.9;;31:29.9;FABIO FERKET
584;111;47;28:35.7;2;2;Eliminate the daisy chain by installing more fibre connectivity;Eliminate the daisy chain by installing more fibre connectivity;2;2;Most of the LAN design is compliant but there is a daisy chained connection between the warehouse and weighbridge area.;Most of the LAN design is compliant but there is a daisy chained connection between the warehouse and weighbridge area.  plant LAN is fully compliant;27:40.7;;27:40.7;CHRIS SOUTHERN
585;114;51;16:56.2;1;1;;Security assessment;2;2;Not applicable - no security solutions found in the inventory.  No guest wifi solution found in the inventory.;Not applicable - no security solutions found in the inventory.  No guest wifi solution found in the inventory.;16:12.8;;16:12.8;CHRIS SOUTHERN
586;5;26;11:23.5;2;3;consider installing camera's for CR having exterior windows;consider installing camera's for CR having exterior windows;2;5;;recommendations implemented as part of P-117018;;;;
587;34;46;06:08.5;1;3;LAN Redesign;;2;6;Single points of failure exist in LAN;LAN devices have been life-cycled and they are compliant;;;;
588;34;47;06:36.4;1;2;LAN Redesign;LAN Assessment;2;2;EOL HW exists in LAN;LAN has been lifecycled, but there is no recent LAN documentation;;;;
589;34;51;06:49.4;3;3;;;6;6;Standard plant segmentation solution exists;Standard plant segmentation solution is deployed;;;;
590;68;43;53:11.6;2;3;SD WAN regional program will take care (P-474706).;;6;6;Hardware is Cargill standard. OS currently out of date.;SDWAN standard devices are deployed;22:16.9;;22:16.9;ALEX ABREU
591;68;45;53:26.5;3;3;;;6;6;Cargill standard MPLS primary with ISP backup. Suitable for site.;SDWAN standard solution is deployed;22:53.9;;22:53.9;ALEX ABREU
592;113;44;58:18.0;3;1;;SDWAN project has not upgraded WAN circuits so it is recommended to open a separate small work to handle this;6;2;No known WAN capacity concerns;Occasional high utilization on the MPLS circuit could cause performance issues.  In the event of a failure on the DIA circuit, the MPLS circuit will not have enough capacity to carry the site traffic.;17:02.1;;17:02.1;CHRIS SOUTHERN
593;5;21;11:35.4;1;3;remove boxes. This is a fire hazard as it acts as a fire accelerator;remove boxes. This is a fire hazard as it acts as a fire accelerator;2;5;;recommendations implemented as part of P-117018;;;;
594;5;21;38:10.2;3;1;remove boxes. This is a fire hazard as it acts as a fire accelerator;spare parts like screen, cabling laying on the floor in service room 2nd floor (office building);5;2;recommendations implemented as part of P-117018;most locations have been cleaned and tidied up a lot as part of P-117018;;;11:35.4;FABIO FERKET
595;5;21;39:15.0;1;1;spare parts like screen, cabling laying on the floor in service room 2nd floor (office building);spare parts like screen, cabling laying on the floor in service room 2nd floor (office building);2;2;most locations have been cleaned and tidied up a lot as part of P-117018;Other locations as far as visible on pictures have been cleaned and tidied up as part of P-117018;;;38:10.3;FABIO FERKET
596;119;4;14:53.1;2;2;New servers are already built and handed over. Cutover needs to be expedited.;;3;3;Vhfrnant001 - Standalone host is pending for decom, needs to be expedited. 2 servers ( MSFRNANT005 2008 - OS & MSFRNANT007 - 2012 OS) with EOL OS are required cutover . New servers are already builT and handed over.;;14:31.3;;14:31.3;DEVAPRABHUPENNIEL CHELLAPPA
597;119;1;14:55.5;2;2;New servers are already built and handed over. Cutover needs to be expedited.;New servers are already built and handed over. Cutover needs to be expedited.;3;3;;Vhfrnant001 - Standalone host is pending for decom, needs to be expedited. 2 servers ( MSFRNANT005 2008 - OS & MSFRNANT007 - 2012 OS) with EOL OS are required cutover . New servers are already builT and handed over.;14:47.1;;14:47.1;DEVAPRABHUPENNIEL CHELLAPPA
598;119;4;15:20.1;2;3;;NA;3;5;;Available for VRTX , no Standalone critical servers identified;14:31.3;;14:53.1;DEVAPRABHUPENNIEL CHELLAPPA
599;117;4;30:41.5;3;3;;;2;2;Supported HW and Supported OS for guest;NA;30:31.6;;30:31.6;DEVAPRABHUPENNIEL CHELLAPPA
600;117;15;32:02.8;3;3;;;2;2;;NA;31:59.0;;31:59.0;DEVAPRABHUPENNIEL CHELLAPPA
601;118;3;38:51.5;3;3;;;2;2;NA;NA;38:42.8;;38:42.8;DEVAPRABHUPENNIEL CHELLAPPA
602;118;3;38:56.4;3;3;;;2;2;NA;up to date;38:42.8;;38:51.5;DEVAPRABHUPENNIEL CHELLAPPA
603;89;52;09:35.6;3;2;;decommission unsupported CargillFoodsFrance1 wifi service;6;2;Standard plant segmentation solution deployed with fully redundant design with dual core switches and Checkpoint firewalls..  Standard guest wifi solution also deployed and fully managed.;Standard plant segmentation solution deployed with fully redundant design with dual core switches and Checkpoint firewalls..  Standard guest wifi solution also deployed and fully managed.  HOWEVER, we have found an unmanaged and non standard guest wifi service called CargillFoodsFrance1 which has caused conflict and interference in the past.  This is a security concern.;33:24.4;;34:16.4;CHRIS SOUTHERN
604;128;44;32:38.1;3;3;;;6;6;no known WAN capacity concerns;no known WAN capacity concerns;32:32.2;;32:32.2;CHRIS SOUTHERN
605;128;54;34:27.9;1;1;;Voice infra assessment;2;2;No supported voice infra found in the inventory;No supported voice infra found in the inventory;34:16.9;;34:16.9;CHRIS SOUTHERN
606;118;43;50:07.4;3;2;;;2;3;Current Cisco hardware is deployed;Legacy Cisco hardware is deployed;49:03.9;;49:03.9;CHRIS SOUTHERN
607;121;44;54:58.9;2;2;SDWAN program will replace WAN solution;SDWAN program will replace WAN solution;6;3;Occasional WAN capacity concerns could be causing performance issues for users;Occasional WAN capacity concerns could be causing performance issues for users;54:53.8;;54:53.8;CHRIS SOUTHERN
608;126;52;43:11.0;3;2;;Explore the value of deploying standard Cargill guest wifi solution;6;2;Security solution not required at this site;Security solution not required at this site, but no guest managed wifi solution exists.;42:15.7;;42:15.7;CHRIS SOUTHERN
609;20;46;20:32.4;1;3;Full LAN redesign;;2;6;Single core switch in admin and plant;Dual core switch is now deployed in admin LAN;;;;
610;124;45;30:10.9;1;3;;;2;2;Cargill standard SD WAN solution installed;Cargill standard SD WAN solution installed;30:02.0;;30:02.0;ALEX ABREU
611;128;42;20:20.1;0;3;;;6;6;;;20:12.5;;20:12.5;FABIO FERKET
612;125;26;30:40.6;;;;Assessment needed to evaluate current status;2;2;no information available;no information available;25:26.6;;25:26.6;FABIO FERKET
613;125;37;41:45.9;1;1;check age and battery health of UPS, according to picture the UPS might be quite old;check age and battery health of UPS, according to picture the UPS might be quite old.;2;2;;risk is that in case it is needed it doesn't if batteries are bad;41:04.6;;41:04.6;FABIO FERKET
614;124;9;34:51.6;3;2;;Iosafe device is out of warranty;5;5;;Iosafe device is out of warranty;34:11.6;;34:11.6;ASHISH KHADKE
615;123;1;09:52.0;2;3;;;5;5;All HW is under warranty and Servers are with updated OS.;All HW is under warranty and Servers are with updated OS.;09:45.2;;09:45.2;DEVAPRABHUPENNIEL CHELLAPPA
616;61;16;30:27.7;1;1;Main computer room is ok, other two rooms in bad shape, ceiling damaged, exterior windows present, window in roof present, heating readioator, and carpet floor present. move rooms to better location;Main computer room is ok, other two rooms in bad shape, ceiling damaged, exterior windows present, window in roof present, heating readiator, and carpet floor present. move rooms to better location, gate keeper room seems to have water leakage (note from SDWAN project);2;2;;;33:43.4;;03:39.0;FABIO FERKET
617;61;22;32:55.9;2;2;Main CR is fine. other two rooms need to be improved to 80 minutes fire resistant;Main CR is fine. other two rooms need to be improved to 60 minutes fire resistant;2;2;;;32:20.2;;16:11.8;FABIO FERKET
618;35;43;36:03.1;3;3;;;6;6; ;SDWAN devices deployed;;;;
619;48;46;40:45.0;2;2;;;2;2;LAN is compliant but switches should be planned to be replaced;LAN is compliant but 2960X switches are approaching life cycle status;34:51.6;;38:27.0;Jim McColl
620;48;50;41:20.3;2;3;;;2;2;WAPs compliant but will not support wifi6;wireless solution is compliant;36:56.9;;39:45.0;Jim McColl
621;14;46;49:10.4;1;3;EOL switches &unmanaged switches;;2;6;Perform LC;All devices compliant following P-688505;;;;
622;80;45;14:28.4;3;2;;Deploy SD WAN;6;3;;SD WAN project on going;47:04.7;;47:04.7;ALEX ABREU
623;14;49;51:06.4;1;2;old & Unmanaged WAP's;;2;2;;Most of the new WAPs are compliant following P-688505.  One or two old WAPs still exist;;;;
624;130;42;17:33.7;3;3;replace lengthy cabling with by proper length cabling and remove unused cabling;replace lengthy cabling with by proper length cabling and remove unused cabling;2;2;Note that in the CR, cabling is in a good shape, recommendations concern the network cabinets. also note that information is two years old;Note that in the CR, cabling is in a good shape, recommendations concern the network cabinets. also note that information is two years old;12:55.2;;12:55.2;FABIO_FERKET@CRGL-THIRDPARTY.COM
625;131;51;31:45.4;3;3;;;2;6;;N/A;31:33.5;;31:33.5;CHRIS_SOUTHERN@CRGL-THIRDPARTY.COM
626;131;47;31:55.4;3;3;;;6;6;;N/A;31:02.3;;31:02.3;CHRIS_SOUTHERN@CRGL-THIRDPARTY.COM
627;9;49;06:10.3;2;1;WAP's to replace;LAN / Wireless redesign;2;2;;Five unmanaged / unsupported end of life WAPs found;;;;
628;116;47;07:09.2;2;2;;LAN/cabling Assessment;2;2;LAN is compliant, but a couple of switches have single uplinks.;LAN is compliant, but a couple of switches have single uplinks.  No recent LAN documentation is available.;03:25.8;;03:25.8;CHRIS SOUTHERN
629;5;42;04:16.0;1;3;sharp bends in cabling and cabling stretches (especially fibre cabling is sensitve for damage due to sharp bends and stretched cabling). cleanup cabling, remove unused cabling and replace cabling by proper length cabling;sharp bends in cabling and cabling stretches (especially fibre cabling is sensitve for damage due to sharp bends and stretched cabling). cleanup cabling, remove unused cabling and replace cabling by proper length cabling;2;5;;reccomendations implemented as part of P-117018;;;;
630;5;19;04:46.7;2;3;cable trays placed under raised floor. This can block cold air that is supplied via plenumn, make sure there is enough cold airflow going to the IT rakcs;cable trays placed under raised floor. This can block cold air that is supplied via plenumn, make sure there is enough cold airflow going to the IT rakcs;2;5;;recommendations implemented as part of P-117018;;;;
631;5;41;32:20.9;1;3;install shelves to place devices on that are not rack mountable;install shelves to place devices on that are not rack mountable;2;5;;recommendations implemented as part of P-117018;;;;
632;5;33;32:35.9;2;2;check whether daisy chained RPDU's are present. No information provided during assessment;check whether daisy chained RPDU's are present. No information provided during assessment;2;5;;recommendations implemented as part of P-117018;;;;
633;5;33;32:48.2;2;3;check whether daisy chained RPDU's are present. No information provided during assessment;check whether daisy chained RPDU's are present. No information provided during assessment;5;5;recommendations implemented as part of P-117018;recommendations implemented as part of P-117018;;;32:35.9;FABIO FERKET
634;5;39;33:14.5;1;3;several racks ar to small te porperly house equipment (not deep enough) replace them with standard racks;several racks ar to small te porperly house equipment (not deep enough) replace them with standard racks;2;5;;recommendations implemented as part of P-117018;;;;
635;5;40;33:34.8;1;3;several racks cannotbe closed because of cabling hanging out of the racks, or exiting the racks to make connections to devices, cable cleanup required to solve this;several racks cannotbe closed because of cabling hanging out of the racks, or exiting the racks to make connections to devices, cable cleanup required to solve this;2;5;;recommendations implemented as part of P-117018;;;;
636;5;40;33:49.3;3;3;several racks cannotbe closed because of cabling hanging out of the racks, or exiting the racks to make connections to devices, cable cleanup required to solve this;several racks cannot be closed because of cabling hanging out of the racks, or exiting the racks to make connections to devices, cable cleanup required to solve this;5;5;recommendations implemented as part of P-117018;recommendations implemented as part of P-117018;;;33:34.8;FABIO FERKET
637;5;20;34:06.1;1;3;remove spare parts, non active IT equipment  and desks that are used as permanent office space. A workbcnh is allowed. If required a metal lockable cabinet can be installed for small spare parts;remove spare parts, non active IT equipment  and desks that are used as permanent office space. A workbcnh is allowed. If required a metal lockable cabinet can be installed for small spare parts;2;5;;recommendations implemented as part of P-117018;;;;
638;21;28;12:31.2;3;3;;;2;6;;;12:26.5;;12:26.5;FABIO FERKET
639;34;52;06:58.0;2;2;;;2;2;Some unmanaged devices in protected plant LAN;Some unmanaged devices in protected plant LAN;;;;
640;34;53;07:37.6;1;1;Skype deployment;Voice infra assessment, possible Teams/Skype deployment;2;2;Standard voice solution not found;Standard voice solution not found in the inventory;;;;
641;5;16;34:26.3;1;2;to comply with standard a CR should not have exterior walls, this cannot be fixed, but noted as a risk. Where applicable, close the raisd floor. This is a tripping hazard and thus a safety issue;to comply with standard a CR should not have exterior walls, this cannot be fixed, but noted as a risk. Where applicable, close the raisd floor. This is a tripping hazard and thus a safety issue;2;5;;recommendations implemented as part of P-117018;;;;
642;94;43;41:13.4;2;3;P-474706 - GN-Software-defined Wide Area Network (SD WAN) Program: EMEA Implementation (FB) - This project will take care of replacing routers that will be end of life by end of 2022.;.;3;6;Both existing routers will be end of life by end of 2022.;Standard SDWAN devices are deployed;14:39.5;;14:39.5;ALEX ABREU
643;94;45;41:39.3;2;3;P-474706 - GN-Software-defined Wide Area Network (SD WAN) Program: EMEA Implementation (FB) - The site is a tier 2 location so topology should be MPLS with ISP. This will be taken care of via this project.;;3;6;;Standard SDWAN solution has been deployed;27:44.8;;27:44.8;ALEX ABREU
644;8;43;42:42.4;3;3;;;6;6;Routers due to be life cycled by Dec 2022. However, SD WAN project should take care with new hardware;Standard SDWAN devices are deployed;;;;
645;8;45;42:56.2;3;3;;;6;6;;Standard SDWAN solution is deployed;;;;
646;14;43;43:25.5;3;3;;;6;6;;Standard SDWAN devices are deployed;;;;
647;14;45;43:43.9;3;3;;;6;6;;Standard SDWAN solution is deployed;;;;
648;47;43;45:10.0;3;3;;;5;6;Standard solution is deployed;Standard SDWAN devices have been deployed;36:40.0;;36:40.0;Jim McColl
649;47;45;45:24.3;3;3;;;5;6;;Standard SDWAN solution is deployed;37:14.5;;37:14.5;Jim McColl
650;88;43;21:39.6;2;3;WAN infra will be replaced by the SDWAN program;;3;6;WAN routers are approaching hardware end of support;Standard SDWAN devices have been deployed;27:01.3;;27:01.3;CHRIS SOUTHERN
651;88;45;22:03.8;2;2;WAN infra will be replaced by the SDWAN program;;3;6;WAN infra has the appropriate capacity and level of redundancy, but the hardware is almost end of support.;Standard SDWAN solution has been deployed;28:05.8;;28:23.3;CHRIS SOUTHERN
652;20;47;33:43.0;1;2;Full LAN redesign;Full LAN redesign;2;2;Many daisy chain connections and SPOF connections exist in admin and plant;Daisy chain connections were removed during P-793427 but single fibre connections still exist in admin and plant;;;;
653;20;51;34:22.3;1;2;Build redundancy in plant seg;Build redundancy in plant seg;2;2;Single firewall exists in plant segmentation solution;Single firewall exists in plant segmentation solution;;;;
654;20;52;35:08.7;1;2;;Consider implementing redundancy to LAN to L2 connectivity;2;2;;plant segmentation is deployed but all devices and connection are SPOF.;;;;
655;48;38;10:22.0;;3;;;6;6;;;10:13.1;;10:13.1;FABIO FERKET
656;130;22;31:00.5;2;2;no fully demised walls present, meaning that fire can spread above the suspended ceiling. if possible seal the CR as much as possible to prevent spreading fire.;no fully demised walls present, meaning that fire can spread above the suspended ceiling. if possible seal the CR as much as possible to prevent spreading fire.;2;2;note that info is two years old (assessment performed 08/08/2019);there is an automatic fire suppression system present, so the urgency correcting this is low.note that info is two years old (assessment performed 08/08/2019);30:00.0;;30:00.0;FABIO_FERKET@CRGL-THIRDPARTY.COM
657;130;26;33:43.3;;;;;2;2;;not known whether there is camera surveillance on the premisesnote that info is two years old (assessment performed 08/08/2019);20:05.0;;20:05.0;FABIO_FERKET@CRGL-THIRDPARTY.COM
658;130;40;37:43.0;3;3;;;6;6;;note that info is two years old (assessment performed 08/08/2019);37:31.3;;37:31.3;FABIO_FERKET@CRGL-THIRDPARTY.COM
659;137;42;34:37.6;;;Perform assessment to determine health state;;2;2;;;22:06.2;;22:06.2;FABIO_FERKET@CRGL-THIRDPARTY.COM
660;137;26;34:55.4;;;Perform assessment to determine health state;Perform assessment to determine health state;2;2;;;21:47.9;;21:47.9;FABIO_FERKET@CRGL-THIRDPARTY.COM
661;4;46;44:15.1;3;2;;Unmanaged switch found on the Plant Network. This switch is non-cisco. Switch needs to be removed or replaced with Cargill standard.;6;1;;I small work has been opened to review and replace this switch (P-1093111). As part of that small work time will be set aside to review the network to find any other unmanaged devices.;;;;
662;123;47;21:22.1;2;2;Remove some remaining daisy chains;Remove some remaining daisy chains and site would gain redundancy if the core admin Layer 3 can be redesigned (if physical site environment allows it).;2;2;Overall in good state but further improvements can be made.;Overall in good state but further improvements can be made.;15:16.1;;15:16.1;ALEX ABREU
