id;siteId;assessmentCriteriaId;logDate;oldScore;newScore;oldRecommendationDescription;newRecommendationDescription;oldRecommendationStatusId;newRecommendationStatusId;oldNotes;newNotes;createDate;createdBy;updateDate;updatedBy
1175;79;46;06:27.4;2;2;;Consider adding HA to admin core switches, lifecycle L2 switches.;2;2;LAN devices are in compliance, core switches will be in life cycle scope in the next FY;Admin core switch is a single stack and is approaching EOL hardware status.  L2 switches have appropriate HA uplinks but are all 2960X models.;41:27.6;;41:27.6;CHRIS SOUTHERN
1176;79;46;06:58.8;2;2;Consider adding HA to admin core switches, lifecycle L2 switches.;Lifecycle L2 switches.;2;2;Admin core switch is a single stack and is approaching EOL hardware status.  L2 switches have appropriate HA uplinks but are all 2960X models.;Admin core switch is approaching EOL hardware status.  L2 switches are all 2960X models which are approaching EOL.;41:27.6;;06:27.4;CHRIS_SOUTHERN@CRGL-THIRDPARTY.COM
1177;79;47;07:24.9;3;2;;Consider adding HA to admin core switch;6;2;LAN standards have good level of redundancy;Admin core switch is a single stack switch;41:52.4;;41:52.4;CHRIS SOUTHERN
1178;38;45;10:17.9;3;3;;;6;6;WAN infra has appropriate redundancy;Standard SDWAN solution is deployed;;;;
1179;38;46;10:56.4;3;3;;;3;6;LAN is compliant after 'P-609202 Sofia Remediation';LAN devices are current and fully compliant;;;57:58.7;CHRIS SOUTHERN
1180;77;47;27:29.5;2;1;LAN redesign;LAN redesign;2;2;The LAN has a partly non-standard design with daisy chaining from office server room to the feed plant.;The LAN has a partly non-standard design with daisy chained switches found in admin LAN, from office server room to the feed plant.  Most L2 switches have dual uplinks;19:47.1;;19:47.1;CHRIS SOUTHERN
1181;77;44;30:26.3;1;2;Upgrade both WAN circuits;Assess capacity on both WAN circuits;2;2;High utilisation detected on both circuits.  A failure of one circuit will cause service degradation;SDWAN is deployed - minor capacity concerns on both circuits or medium risk of degradation if one circuit fails;14:59.5;;17:26.1;CHRIS_SOUTHERN@CRGL-THIRDPARTY.COM
1182;77;50;33:26.7;2;1;;Wireless assessment;2;2;Standard solution is deployed but many WAPs are connected to single switches meaning there is risk to lose the WAPs.  The WLCs and many WAPs approaching end of hardware support;Standard solution is deployed but many WAPs are connected to single switches, and some WAPs are connected to a daisy chained switch, meaning there is risk to lose wireless service.;33:16.7;;35:42.3;CHRIS_SOUTHERN@CRGL-THIRDPARTY.COM
1183;79;51;08:43.8;3;2;;;6;2;Standard plant segmentation solution is deployed, firewall hardware is current.;Standard plant segmentation solution is deployed, firewall hardware is current. Plant core switches are approaching EOL status.;45:30.7;;45:30.7;CHRIS SOUTHERN
1184;79;52;09:44.0;3;2;;Consider adding redundancy to plant core and L2 uplinks.;6;2;Standard plant segmentation deployed with full redundancy;Standard plant segmentation deployed with firewall redundancy, however plant core is a single stack.  Plant L2 switches have single uplinks.;46:01.2;;46:01.2;CHRIS SOUTHERN
1185;79;50;11:39.0;3;2;;Wireless assessment, consider adding switch redundancy;2;2;Wireless design was implemented in 2018 P-7910;Redundant WLCs are deployed.  However many WAPs in the 'control room' are connected to a single switch.;43:36.5;;43:36.5;CHRIS SOUTHERN
1186;79;49;12:47.2;2;2;;;1;2;Wireless controllers and access points will be in life cycle scope in the next FY;Wireless controllers and access points are end of life and need to be replaced.;42:48.3;;42:48.3;CHRIS SOUTHERN
1187;30;44;37:20.7;2;2;;SDWAN project will replace legacy circuits;2;3;Both circuits show occasional high utilisation, there is risk of performance issues in the event of one circuit failure.;Both MPLS circuits show occasional high utilisation, there is risk of performance issues in the event of one circuit failure.;;;34:18.8;CHRIS_SOUTHERN@CRGL-THIRDPARTY.COM
1188;30;43;37:29.2;2;2;SDWAN will replace legacy routers;SDWAN will replace legacy routers;3;3;2 x MPLS standard design, legacy model routers;2 x MPLS standard design, legacy model routers;;;56:36.2;CHRIS_SOUTHERN@CRGL-THIRDPARTY.COM
1189;30;46;52:40.0;3;2;;Consider adding further redundancy to admin core switch;6;2;LAN devices are current supported models;Admin LAN core is a single stack. L2 LAN devices are mainly 2960X which is approaching EOL hardware status;;;32:42.4;CHRIS_SOUTHERN@CRGL-THIRDPARTY.COM
1190;30;47;53:34.4;2;1;;LAN assessment, eliminate daisy chains, consider adding redundancy to admin core switches;2;2;Daisy chain and single L2 uplinks in LAN;Admin core is a single stack, L2 switches have some HA, some daisy chain exists for a few L2 switches.;;;21:30.1;CHRIS_SOUTHERN@CRGL-THIRDPARTY.COM
1191;16;47;27:49.9;1;1;;LAN redundancy, remove daisy chains and provide dual uplinks;2;3;;P-419705 still ongoing;;;;
1192;16;51;29:41.5;3;1;;Remove daisy chains and remove unmanaged switches;6;3;;Project P-419705 is still ongoing;;;;
1193;16;52;30:38.6;3;1;;Remove daisy chains and remove unmanaged switches;6;3;;Project P-419705 is still ongoing;;;;
1194;16;45;36:00.4;3;2;;Additional ISP needed for tier 1 critical site;6;2;;;;;;
1195;2;52;02:09.1;3;1;;Deploy Plant L2 redundancy;6;6;;;;;;
1196;1;14;53:45.1;1;1;same as above;same as above;1;6;;5th July : the only SQL DB server was MSDEMALO028 which is now decommissioned  CRQ000000680335;;;;
1197;30;46;54:09.5;2;2;Consider adding further redundancy to admin core switch;;2;2;Admin LAN core is a single stack. L2 LAN devices are mainly 2960X which is approaching EOL hardware status;Admin LAN core is fully supported model but its a single stack. L2 LAN devices are mainly 2960X which is approaching EOL hardware status;;;52:40.0;CHRIS_SOUTHERN@CRGL-THIRDPARTY.COM
1198;30;51;56:14.0;1;3;;;3;6;standard plant segmentation devices are delivered, waiting for BU approval and availability for deployment.;Standard plant firewall devices are deployed, plant core is fully supported model;;;51:39.0;CHRIS_SOUTHERN@CRGL-THIRDPARTY.COM
1199;30;52;56:48.7;1;3;;;3;6;standard plant segmentation devices are delivered, waiting for BU approval and availability for deployment.;standard plant segmentation solution is deployed with full HA in plant LAN;;;51:54.8;CHRIS_SOUTHERN@CRGL-THIRDPARTY.COM
1200;30;50;06:36.5;1;1;Remove daisy chains;Remove daisy chains;2;2;Single switches have many WAPs connected, daisy chain design means that multiple WAPs are at risk;Single switches have many WAPs connected, daisy chain design means that multiple WAPs are at risk;;;33:42.8;CHRIS_SOUTHERN@CRGL-THIRDPARTY.COM
1201;4;46;25:02.6;2;2;Unmanaged switch found on the Plant Network. This switch is non-cisco. Switch needs to be removed or replaced with Cargill standard.;Increase L2 switch redundancy and eliminate EOS hardware;1;3;I small work has been opened to review and replace this switch (P-1093111). As part of that small work time will be set aside to review the network to find any other unmanaged devices.;Project P-953802 reviewing L2 switch redundancy.;;;44:15.1;ALEX ABREU
1202;4;47;25:48.5;1;1;Assess dual hardware need Dual link connect. Re-design DMZ/privilege network;Assess dual hardware need Dual link connect. Re-design DMZ/privilege network;2;3;57 switches are hardware single point of failure, 15 network devices are single link connected & DMZ/privilege hardware required review. For a Tier 1 location it is required to have redundancy19-Jan2021: very old unmanaged switches found in plant LAN, using SWKREAUTxxx naming convention.;57 switches are hardware single point of failure, 15 network devices are single link connected & DMZ/privilege hardware required review. For a Tier 1 location it is required to have redundancy19-Jan2021: very old unmanaged switches found in plant LAN, using SWKREAUTxxx naming convention.;;;57:20.6;CHRIS SOUTHERN
1203;4;52;46:58.3;3;1;;Plant LAN requires hardware redundancy;6;3;Standard plant FW segmentation solution found;Project P-953802 should be taking care of increasing hardware redundancy;;;;
1204;4;44;52:31.9;2;3;;;3;6;High WAN usage, one circuit failure would cause application performance issues;Capacity issue resolved since SD WAN upgrade;;;09:20.0;CHRIS_SOUTHERN@CRGL-THIRDPARTY.COM
1205;4;43;52:51.6;3;3;;;6;6;Routers due to be life cycled by Dec 2020. However, SD WAN project should take care with new hardware;Routers replaced by SD WAN program;;;;
1206;4;50;54:35.8;3;2;;Wireless assessment recommended;6;2;;;;;;
1207;52;46;56:57.5;3;3;;;6;6;;;52:11.6;;52:11.6;David Vergara Manrique
1208;52;47;57:54.6;3;2;;Admin LAN hardware redundancy for switches with multiple WAPs connected to it;6;2;;;52:36.9;;52:36.9;David Vergara Manrique
1209;52;49;01:07.6;1;3;;;2;6;;Hardware is compliant;55:32.2;;55:32.2;David Vergara Manrique
1210;52;50;01:43.6;1;2;;WAPs connected to single switches without HA;2;2;;;55:34.9;;55:34.9;David Vergara Manrique
1211;1;51;36:03.6;3;2;;L3 plant core is L2 switch. This might be acceptable but not standard;6;2;Standard plant FW segmentation solution found;;;;;
1212;1;52;36:41.3;3;2;;L3 plant core is L2 switch. This might be acceptable but not standard;6;2;Standard plant FW segmentation solution found;;;;;
1213;35;44;53:02.8;3;3;;;6;6;Appropriate capacity exists;No concerns with WAN capacity;;;30:18.1;CHRIS_SOUTHERN@CRGL-THIRDPARTY.COM
1214;35;43;53:18.7;3;3;;;6;6;SDWAN devices deployed;Standard SDWAN devices are deployed;;;36:03.2;CHRIS SOUTHERN
1215;13;46;05:22.1;1;1;Replace EOL devices;Replace EOL devices;3;3;Some devices have been life cycled but many EOL devices are still pending to be replaced.  Multiple unsupported HP devices still present in legacy LAN.;The below is still true. Re-design of the network really needed to enable hardware to be appropriately configured and purposed correctly.Some devices have been life cycled but many EOL devices are still pending to be replaced.  Multiple unsupported HP devices still present in legacy LAN.;;;31:51.2;CHRIS_SOUTHERN@CRGL-THIRDPARTY.COM
1216;13;46;05:33.6;1;1;Replace EOL devices;Replace EOL devices;3;2;The below is still true. Re-design of the network really needed to enable hardware to be appropriately configured and purposed correctly.Some devices have been life cycled but many EOL devices are still pending to be replaced.  Multiple unsupported HP devices still present in legacy LAN.;The below is still true. Re-design of the network really needed to enable hardware to be appropriately configured and purposed correctly.Some devices have been life cycled but many EOL devices are still pending to be replaced.  Multiple unsupported HP devices still present in legacy LAN.;;;05:22.1;ALEX_ABREU@CRGL-THIRDPARTY.COM
1217;13;47;05:50.1;1;1;LAN Redesign, remove daisy chains, add uplink redundancy;LAN Redesign, remove daisy chains, add uplink redundancy;2;2;Fibre infrastructure needs work to remove daisy chains and add redundancy, VLANs are not redundant across both core switches;Previously comments still stands.Fibre infrastructure needs work to remove daisy chains and add redundancy, VLANs are not redundant across both core switches;;;16:30.4;CHRIS_SOUTHERN@CRGL-THIRDPARTY.COM
1218;14;51;22:27.3;2;1;;Replace firewall with dual HA pair;2;2;Plant firewall is compliant but its SPOF, no guest wifi infra was found.;Plant firewall is compliant but its SPOF.;;;46:47.0;CHRIS_SOUTHERN@CRGL-THIRDPARTY.COM
1219;14;52;23:30.4;2;1;if plant network is critical, must consider adding redundant FWs;Re-design plant network, replace firewall with HA pair, plant core switch requires redundancy and provide additional fibre uplinks where today they are single only.;2;2;Plant segmentation is deployed with a single firewall;;;;49:00.4;CHRIS_SOUTHERN@CRGL-THIRDPARTY.COM
1220;16;43;34:58.6;2;3;SDWAN will replace Cisco 2911 with Dell/Versa hardware;;3;6;50M links on 2911 model, this is higher capacity than engineering standard recommends;Hardware replaced as part of SD WAN program;;;28:33.8;CHRIS_SOUTHERN@CRGL-THIRDPARTY.COM
1221;16;44;36:25.9;1;1;;Additional capacity needed with extra ISP required;2;2;WAN links show frequent high utilisation, failure of one circuit would cause significant performance issues.;WAN links show frequent high utilisation, failure of one circuit would cause significant performance issues.;;;27:53.2;CHRIS_SOUTHERN@CRGL-THIRDPARTY.COM
1222;17;43;50:37.6;2;2;will be replaced under SDWAN regional program;Replace SD WAN hardware with appropriate model for Critical site;3;3;WAN devices are legacy Cisco routers;SD WAN routers are not appropriate for site which should have x1 MPLS and x2 ISPs;;;53:53.4;CHRIS_SOUTHERN@CRGL-THIRDPARTY.COM
1223;17;44;51:24.0;2;2;SDWAN migration;Install additional ISP so it's in line with Critical site topology;3;2;Minor capacity issues noted;Minor capacity issues noted;;;51:05.7;CHRIS_SOUTHERN@CRGL-THIRDPARTY.COM
1224;25;96;47:51.3;3;3;;;6;6;2 extra power strips (professional) lying loose in rack cabinet.;;47:23.7;;47:23.7;YUSRA_ALI@CRGL-THIRDPARTY.COM
1225;25;97;49:24.5;3;3;;;6;6;;2 extra power strips (professional) lying loose in rack cabinet.;47:06.5;;47:06.5;YUSRA_ALI@CRGL-THIRDPARTY.COM
1226;31;51;24:17.9;3;3;;;6;6;N/A - office location only, no plant LAN.;N/A - office location only, no plant LAN.;;;27:44.0;CHRIS_SOUTHERN@CRGL-THIRDPARTY.COM
1227;31;52;24:23.0;3;3;;;6;6;N/A - office location only, no plant LAN.;N/A - office location only, no plant LAN.;;;27:51.6;CHRIS_SOUTHERN@CRGL-THIRDPARTY.COM
1228;2;44;05:29.3;3;2;;Deploy second ISP for critical site;6;2;New circuits deployed by SDWAN project, no known concerns with WAN capacity;New circuits deployed by SDWAN project, no known concerns with WAN capacity;;;53:53.0;CHRIS SOUTHERN
1229;2;45;06:02.2;3;2;;Deploy second ISP;6;2;Standard SDWAN solution is deployed;Standard SDWAN solution is deployed;;;51:14.5;CHRIS SOUTHERN
1230;2;49;07:37.8;2;2;WAPs almost EOL;WAPs and WLCs almost EOL;2;3;LC is planned;LC is planned;;;;
1231;2;50;08:56.0;2;2;;;2;3;;Life cycle to replace hardware;;;;
1232;112;16;32:53.9;1;2;exterior window present, close window permanently, Mold present on walls, where needed coat or repair walls;best would be to replace window by brick wall or move CR to other location. both options are difficult to perform.;2;2;information is more than three years old and is possibly outdated;windows are blocked with a fence, to mitigate risk of burglary;27:18.9;;27:18.9;FABIO FERKET
1233;112;42;35:32.5;1;2;improve cable management by replacing lengthy cabling by proper length cabling, cabling hanging in the air and tied to curtains. properly route cabling via cable trays;improve cable management by replacing lengthy cabling by proper length cabling, cabling hanging in the air and tied to curtains. properly route cabling via cable trays;2;2;information is more than three years old and is possibly outdated;partly cable management is improved in the meanwhile;13:56.1;;20:20.7;FABIO FERKET
1234;112;31;36:31.6;3;3;;;6;6;information is more than three years old and is possibly outdated;room can host a second rack. current rack has not much free space. for now, no action needed;15:33.0;;15:56.9;FABIO FERKET
1235;25;50;46:55.3;1;2;Full WIFI Survey and redesign;;2;2;Supported WAPs approaching EOL status..  According to computex report, multiple existing WAPs have configuration issues; performance impacted by lack of 5gHz coverage, black spots found such as the 'raw material area';One WAP is EOL.  Some single switches with WAPs connected;;;14:19.8;CHRIS SOUTHERN
1236;122;46;37:31.4;3;3;;;2;6;Site only has single L2 switch and that is Cargill standard;All LAN managed LAN devices at the site are compliant;38:48.0;;38:48.0;ALEX ABREU
1237;122;51;47:09.9;;3;;;2;6;There is no security devices at site. It is also unknown if there is a need for one i.e. there could be a unsecured internet line at site providing guest wireless for example.;Plant FW and LAN devices are compliant after plant segmentation project;50:18.2;;50:18.2;ALEX ABREU
1238;122;52;47:55.2;;2;;Consider adding redundancy to plant core switch;2;2;There is no security devices at site. It is also unknown if there is a need for one i.e. there could be a unsecured internet line at site providing guest wireless for example.;Standard plant segmentation solution was deployed in 2022 but there is a single plant core switch.;50:24.3;;50:24.3;ALEX ABREU
1239;122;44;49:53.2;2;3;WAN assessment for possible upgrade;;2;6;Some high utilisation on the primary WAN circuit.  if internet circuit fails the site could have network performance issues;SDWAN is deployed, no concerns with WAN capacity;35:00.3;;36:35.8;CHRIS SOUTHERN
1240;1;15;23:51.4;1;1;same as above (Aug 2020);same as above (Aug 2020);1;6;Under review;Assuming this is for server MSDEMALO028 - Time Recording server -DB . this server has been decommissioned #CRQ000000680335;;;09:48.9;Nadelin Georgiev
1241;31;49;25:15.5;3;3;;;6;6; ;;;;;
1242;31;50;25:21.1;2;2;;;2;2;WAPs compliant but will not support wifi6;WAPs compliant but will not support wifi6;;;;
1243;37;44;38:55.1;3;3;;;6;6; ;No concerns with WAN capacity;;;;
1244;37;43;39:23.5;3;3;;;2;6;Cargill standard in place;Standard SDWAN devices are deployed;;;54:41.5;ALEX ABREU
1245;37;45;39:39.2;3;3;;;6;6;appropriate WAN redundancy is in place;Standard SDWAN soluton is deployed;;;;
1246;37;46;43:16.2;2;3;Lifecycle 2960X switches;;2;6;Some 2960X devices should be replaced;LAN devices are current models and compliant;;;;
1247;1;44;41:30.0;2;1;;Replace WAN links with suitably sized circuits.;2;3;Some high utilisation alarms detetced;Currently if one circuit fails the site will suffer degradation in WAN services. SD WAN project currently ongoing which should address this.;;;;
1248;1;43;42:34.0;3;2;;SD WAN hardware to be deployed;6;6;;SD WAN Program to take care of this. Existing legacy hardware is fine and within LC;;;;
1249;1;45;43:17.8;3;2;;Change to SD WAN;6;3;;SD WAN program to take care of standards compliance;;;;
1250;1;49;43:51.6;1;3;EOL WAPs found;;2;6;;All WAPs used are within LC;;;;
1251;1;50;45:00.1;2;2;;Multiple WAPs are connected to single switch which creates single point of failure. Consider hardware redundancy so WAP up time is increased;2;2;;;;;;
1252;94;46;01:56.8;2;3;P-773721 - BOSC Create - Vilvoorde Network Lifecycle - This project is taking care of replacing end of life LAN hardware. On the LAN there are two switch stacks still to be replaced as part of this project.;;3;6;;All hardware is within LC;40:30.8;;40:30.8;ALEX ABREU
1253;94;47;03:47.2;2;3;P-773721 - BOSC Create - Vilvoorde Network Lifecycle - Vilvoorde switch 8 is single fibre connected so should be addressed as part of this project.;;3;6;;Site is meeting Cargill design, hardware and fibre standards;54:28.0;;54:28.0;ALEX ABREU
1254;94;52;06:19.9;2;3;P-773721 - BOSC Create - Vilvoorde Network Lifecycle - Existing Anchor controller for Guest wireless connection is using aging platform. This project should take care of replacing this device.;;3;6;;Site does not have plant network. Pure admin function;48:36.0;;48:36.0;ALEX ABREU
1255;94;49;08:39.7;2;3;P-773721 - BOSC Create - Vilvoorde Network Lifecycle - This project is taking care of replacing end of life hardware, controllers and addressing signal issues by putting wireless access points in more appropriate placement.;;3;6;;All wireless hardware is within LC;55:57.4;;55:57.4;ALEX ABREU
1256;94;50;14:24.3;2;3;P-773721 - BOSC Create - Vilvoorde Network Lifecycle - This project is taking care of replacing end of life hardware, controllers and addressing signal issues by putting wireless access points in more appropriate placement.;;3;6;;Site meeting design and hardware standards;56:15.3;;56:15.3;ALEX ABREU
1257;94;53;15:02.7;2;2;Voice router will be end of life at the end of 2022, so business should budget to replacing Cisco voice solution with new Cargill standard MS Teams (with Central SIP).;Voice router will be end of life at the end of 2022, so business should budget to replacing Cisco voice solution with new Cargill standard MS Teams (with Central SIP).;2;3;;Site in scope of the Cisco to Teams project.;52:39.8;;52:39.8;ALEX ABREU
1258;94;54;15:10.4;2;2;Voice router will be end of life at the end of 2022, so business should budget to replacing Cisco voice solution with new Cargill standard MS Teams (with Central SIP).;Voice router will be end of life at the end of 2022, so business should budget to replacing Cisco voice solution with new Cargill standard MS Teams (with Central SIP).;2;3;;Site in scope of the Cisco to Teams project.;53:13.9;;53:13.9;ALEX ABREU
1259;1;13;40:21.4;1;1;MSDEMALO028 - time recording application and DB server. This server hosting unsupported SQL DB version. Based on lifecycle log in June 2018 Joern Mahncke confirms there no chance to migrate to newer OS and would suggest to leave the server on the old ESX host. An email sent to Joern Mahncke to update time recording application migration/lifecycle plan . ;MSDEMALO028 - time recording application and DB server. This server hosting unsupported SQL DB version. Based on lifecycle log in June 2018 Joern Mahncke confirms there no chance to migrate to newer OS and would suggest to leave the server on the old ESX host. An email sent to Joern Mahncke to update time recording application migration/lifecycle plan .;1;6;;DECOM CRQ000000680335 Time Recording server -DB;;;;
1260;25;104;36:30.5;3;2;;;6;2;;;36:01.3;;36:01.3;YUSRA_ALI@CRGL-THIRDPARTY.COM
1261;1;1;43:06.6;1;1;vhdemalc001 is end of Life, migrate the VMs to VRTX and decomm the old hosts.MSDEMALP001 - PI Server - 2008 server - Move to PCGMSDEMALC003 - File server - 2008 Server - LC the server;vhdemalc001 is end of Life, migrate the VMs to VRTX and decomm the old hosts.MSDEMALP001 - PI Server - 2008 server - Move to PCGMSDEMALC003 - File server - 2008 Server - LC the server;2;6;OSC to move PI server in PCGDC LC team to LC the File server;OSC to move PI server in PCGDC LC team to LC the File server5th July 2022: vhdemalc001 : Decomm under CRQ000000444754 ESX Host non-clustered;;;;
1262;1;6;44:07.7;2;2;vhdemalc001 is stand alone host, migrate VMs to VRTX and decomm the host;vhdemalc001 is stand alone host, migrate VMs to VRTX and decomm the host;2;6;;5th July 2022: vhdemalc001 Decommissioned under CRQ000000444754 ESX Host non-clustered;;;;
1263;1;3;49:39.1;2;2;VRTX BCDEMALC001 has 2 clustered ESX hosts and are potentially vulnerable;VRTX BCDEMALC001 has 2 clustered ESX hosts and are potentially vulnerable;2;6; review and take necessary action. Operation team to be involved to look on this.;5th July 2022: No longer see any vulnerability notification on ESX hosts hosted on  BCDEMALC001;;;;
1264;1;8;51:07.4;2;2;MSDEMALP001 backup taking more than scheduled window.;MSDEMALP001 backup taking more than scheduled window.;2;6;Operation and OSC team to be involved to look on this.;Operation and OSC team to be involved to look on this.5th July 2022: MSDEMALP001 decommission under CRQ000000429588;;;;
1265;122;47;39:01.1;3;2;;Consider adding redundancy to admin core;2;2;;Admin core switch is a single switch / single point of failure;39:10.9;;39:10.9;ALEX ABREU
1266;101;45;29:54.2;1;3;WAN infra will be replaced during SDWAN migration program;;3;6;WAN infra is active / standby, however, the backup circuit is significantly smaller capacity than the primary WAN, therefore in the event of a primary MPLS failure we could expect performance issues.;Standard SDWAN devices are deployed;15:42.4;;29:04.3;CHRIS SOUTHERN
1267;101;46;34:46.2;2;2;;Replace core switches and L2 switches;2;2;All devices in the inventory are under support but some of them are approaching vendor EOL status.;Admin core switches and many L2 switches are approaching EOL status with the vendor;09:04.3;;09:04.3;CHRIS SOUTHERN
1268;101;47;35:07.7;3;3;;;2;6;All devices in the inventory are dual connected with appropriate redundancy design.;All devices in the admin LAN inventory are dual connected with appropriate redundancy design.;09:29.0;;09:29.0;CHRIS SOUTHERN
1269;101;51;36:02.9;3;2;;;6;2;Plant segmentation is deployed with standard solution.  Standard economy guest wifi solution is deployed to the first floor.;Plant segmentation is deployed with standard solution.  Plant core switches are using a model that is approaching EOL.;10:36.2;;10:36.2;CHRIS SOUTHERN
1270;101;52;36:24.3;3;3;;;6;6;Standard plant segmentation design, with full plant core redundancy is deployed.;Standard plant segmentation design, with full plant core redundancy is deployed.;11:06.0;;11:06.0;CHRIS SOUTHERN
1271;101;49;37:56.3;2;2;;Some WAPs need to be planned for life cycle;3;3;Most wireless devices are fully supported and current models, a few are approaching end of life vendor status and will need to be planned for life cycle;Most wireless devices are fully supported and current models, two are end of life vendor status and a few more are almost EOL.;12:12.2;;12:12.2;CHRIS SOUTHERN
1272;37;47;43:36.0;3;3;;;6;6;LAN has appropriate level of redundancy;LAN has fully standard design and has appropriate level of redundancy;;;;
1273;37;51;44:13.1;3;3;;;6;6;plant segmentation is not required;office locations only!  plant segmentation is not required;;;;
1274;37;52;44:20.3;3;3;;;6;6;plant segmentation is not deployed;office locations only!  plant segmentation is not deployed;;;;
1275;35;45;53:32.0;3;3;;;6;6;Standard SDWAN solution deployed;Standard SDWAN solution is deployed;;;36:16.8;CHRIS SOUTHERN
1276;101;50;38:34.1;3;2;;Evaluate if WLC solution can improve service resilience;6;2;Standard flex connect wireless solution is deployed;Standard flex connect wireless solution is deployed, however no local WLC solution;13:15.8;;13:15.8;CHRIS SOUTHERN
1277;1;42;41:39.7;1;1;;;2;5;;Fabio : Cable management implemented as part of P-610105 CSST Europe - Infra Improvements Malchin.;;;;
